id,task_id,lang,category,type,topic,complexity,image,task,choices,correct_answer,user_answers
91,RgI39GdVS31cO41Y,en,vqa,numeric,animals,2,https://s3-eu-north-1-derc-wmi-crowdlabel-production.s3.eu-north-1.amazonaws.com/tii_vqa_694cf5ka731elfaj.png,what number of other objects are the same material as the yellow object?,"{'a': '4', 'b': '6'}",a,"['a', 'b', 'b', 'a', 'a']"
92,WqRp7RQu4R1ZRliC,en,vqa,numeric,construction-site,2,https://s3-eu-north-1-derc-wmi-crowdlabel-production.s3.eu-north-1.amazonaws.com/tii_vqa_hpp9aaamo9nmgvoz.png,how many big things are either wheelbarrows or cyan objects?,"{'a': '3', 'b': '2'}",b,"['a', 'a']"
93,EL0ev2PQW7H0lmsK,en,vqa,mcq,fashion,3,https://s3-eu-north-1-derc-wmi-crowdlabel-production.s3.eu-north-1.amazonaws.com/tii_vqa_s6bn88wkpgx8ogyb.png,what size is the metal hat that is the same color as the pants?,"{'a': 'small', 'b': 'large'}",b,"['b', 'b', 'a', 'b']"
94,IShaNm9drd6RdLRl,en,vqa,true-false,garage-workshop,1,https://s3-eu-north-1-derc-wmi-crowdlabel-production.s3.eu-north-1.amazonaws.com/tii_vqa_agabc580wi45ogk1.png,are there any other things that have the same material as the tiny purple thing?,"{'a': 'False', 'b': 'True'}",a,"['a', 'a', 'a', 'b', 'b']"
95,dQe0PnrFJNTDPO3d,en,vqa,numeric,kitchen,2,https://s3-eu-north-1-derc-wmi-crowdlabel-production.s3.eu-north-1.amazonaws.com/tii_vqa_r1gle9iypa9hnve3.png,how many red spatulas have the same size as the rubber teapot?,"{'a': '1', 'b': '0'}",a,"['a', 'b', 'a', 'a']"
96,yjm9cgIKYUeQGGZE,en,vqa,numeric,living-room,2,https://s3-eu-north-1-derc-wmi-crowdlabel-production.s3.eu-north-1.amazonaws.com/tii_vqa_jvmnt0bv7hh6c70x.png,how many other objects are there of the same shape as the blue metal object?,"{'a': '1', 'b': '3'}",a,"['b', 'b', 'b', 'b']"
97,gwgfFA45ww5sNHJb,en,vqa,mcq,medical-field,4,https://s3-eu-north-1-derc-wmi-crowdlabel-production.s3.eu-north-1.amazonaws.com/tii_vqa_c8foaxo1l6j7ilx8.png,there is a purple metal object that is the same size as the metal iv fluid bag; what shape is it?,"{'a': 'iv fluid bag', 'b': 'medicine bottle', 'c': 'injection', 'd': 'stethoscope'}",d,['a']
98,4GXG5ahRuSr6Ojca,en,vqa,mcq,music,4,https://s3-eu-north-1-derc-wmi-crowdlabel-production.s3.eu-north-1.amazonaws.com/tii_vqa_7sn99dbawybr3ewf.png,what color is the rubber mic that is the same size as the blue metal drum?,"{'a': 'purple', 'b': 'blue', 'c': 'green'}",a,"['a', 'a', 'b', 'b']"
99,ZRJg4VEjjQudIWO3,en,vqa,true-false,office,1,https://s3-eu-north-1-derc-wmi-crowdlabel-production.s3.eu-north-1.amazonaws.com/tii_vqa_gjs6sendejj2laht.png,is there a big rubber object of the same color as the laptop?,"{'a': 'True', 'b': 'False'}",a,"['a', 'b', 'b', 'a']"
100,zOwrMplBdmSZqSL8,en,vqa,true-false,school,1,https://s3-eu-north-1-derc-wmi-crowdlabel-production.s3.eu-north-1.amazonaws.com/tii_vqa_wqvw56qsdrmn9y1l.png,does the big rubber notebook have the same color as the big metal notebook?,"{'a': 'True', 'b': 'False'}",a,"['b', 'a', 'b']"
101,rQl91EQhcws5d4dk,en,vqa,true-false,uae,1,https://s3-eu-north-1-derc-wmi-crowdlabel-production.s3.eu-north-1.amazonaws.com/tii_vqa_rth7twgcaamau4zd.png,do the yellow rubber object and the blue rubber bedouin tent have the same size?,"{'a': 'False', 'b': 'True'}",a,"['b', 'a']"
102,toQdXvQ53cX1XhcU,en,vqa,true-false,underwater,1,https://s3-eu-north-1-derc-wmi-crowdlabel-production.s3.eu-north-1.amazonaws.com/tii_vqa_ks7hsm7w2q6vq4fz.png,are there any gray things that have the same size as the brown snorkel?,"{'a': 'True', 'b': 'False'}",a,"['a', 'b', 'a']"
103,hpc7kDD5lVB0OrBl,en,vqa,mcq,living-room,3,https://s3-eu-north-1-derc-wmi-crowdlabel-production.s3.eu-north-1.amazonaws.com/tii_vqa_lge7k7a7vnj0cy3y.png,there is another object that is the same shape as the small rubber thing; what is its material?,"{'a': 'rubber', 'b': 'metal'}",a,"['a', 'a', 'a', 'a']"
104,bKAxMz3tKgZfvgSx,en,vqa,true-false,kitchen,1,https://s3-eu-north-1-derc-wmi-crowdlabel-production.s3.eu-north-1.amazonaws.com/tii_vqa_4pc8afpxsma5es3d.png,do the metal plate and the blue spatula have the same size?,"{'a': 'False', 'b': 'True'}",b,"['a', 'a', 'a', 'b', 'a', 'a', 'b']"
105,Kb45sPoTYlrRo1Tr,en,vqa,numeric,construction-site,2,https://s3-eu-north-1-derc-wmi-crowdlabel-production.s3.eu-north-1.amazonaws.com/tii_vqa_zrfhi02whguiqmoz.png,what number of brown things are big traffic cones or rubber objects?,"{'a': '4', 'b': '6'}",a,"['b', 'a']"
106,IgdgJZfm1vgcPgqB,en,vqa,numeric,animals,2,https://s3-eu-north-1-derc-wmi-crowdlabel-production.s3.eu-north-1.amazonaws.com/tii_vqa_alchj8gyticipioh.png,what number of objects are either small gray dogs or blue dogs?,"{'a': '1', 'b': '2'}",b,"['a', 'b', 'a', 'b']"
107,K7w2Mf4Inr1bOKI8,en,vqa,mcq,construction-site,3,https://s3-eu-north-1-derc-wmi-crowdlabel-production.s3.eu-north-1.amazonaws.com/tii_vqa_q72upaipkdzavanh.png,what size is the blue rubber wheelbarrow?,"{'a': 'small', 'b': 'large'}",a,"['a', 'a', 'a']"
108,T2SwrzpT5JGv4AWl,en,vqa,true-false,fashion,1,https://s3-eu-north-1-derc-wmi-crowdlabel-production.s3.eu-north-1.amazonaws.com/tii_vqa_toyoj1un1scoruuk.png,is there a yellow metal object of the same size as the yellow metal shoe?,"{'a': 'False', 'b': 'True'}",b,"['a', 'b', 'b', 'b', 'b', 'b']"
109,DWuVxSChyh6tzSlN,en,vqa,numeric,garage-workshop,2,https://s3-eu-north-1-derc-wmi-crowdlabel-production.s3.eu-north-1.amazonaws.com/tii_vqa_u3s2pg77vrg97pcb.png,what number of objects have the same material as the brown wrench?,"{'a': '4', 'b': '6'}",a,"['a', 'a', 'a', 'a']"
110,C9DvBf7BVynBM88M,en,vqa,true-false,kitchen,1,https://s3-eu-north-1-derc-wmi-crowdlabel-production.s3.eu-north-1.amazonaws.com/tii_vqa_efkduxnstreixhgu.png,is the small rubber teapot the same color as the big rubber plate?,"{'a': 'False', 'b': 'True'}",b,"['a', 'a', 'a']"
111,gTwkRK4KJleKI0W2,en,vqa,mcq,living-room,3,https://s3-eu-north-1-derc-wmi-crowdlabel-production.s3.eu-north-1.amazonaws.com/tii_vqa_hk12m7oxt9g14xo7.png,what is the size of the rubber thing that is the same color as the television?,"{'a': 'large', 'b': 'small'}",a,"['b', 'b', 'a']"
112,sLlaxQxM7Jtq5Xf9,en,vqa,numeric,medical-field,2,https://s3-eu-north-1-derc-wmi-crowdlabel-production.s3.eu-north-1.amazonaws.com/tii_vqa_ue9ekrzu74h8weml.png,what number of other objects are the same size as the gray rubber injection?,"{'a': '2', 'b': '1'}",a,"['a', 'a', 'b', 'b', 'a']"
113,rricp3xYgabNHNp8,en,vqa,mcq,music,3,https://s3-eu-north-1-derc-wmi-crowdlabel-production.s3.eu-north-1.amazonaws.com/tii_vqa_iz96moo681i9n328.png,there is another small thing that is the same color as the small metal thing; what is its material?,"{'a': 'rubber', 'b': 'metal'}",a,"['b', 'a', 'b', 'a']"
114,seGNuyuGRogF0w9V,en,vqa,true-false,office,1,https://s3-eu-north-1-derc-wmi-crowdlabel-production.s3.eu-north-1.amazonaws.com/tii_vqa_a58fulwhwnwgrma0.png,is there anything else that is the same shape as the brown metal thing?,"{'a': 'True', 'b': 'False'}",b,"['a', 'a', 'b', 'b', 'a']"
115,vYMwzjPVyikiWVL2,en,vqa,numeric,school,2,https://s3-eu-north-1-derc-wmi-crowdlabel-production.s3.eu-north-1.amazonaws.com/tii_vqa_16fkziijl3rpa6aw.png,how many metal things are either tiny pencils or objects?,"{'a': '4', 'b': '6'}",a,"['a', 'a', 'a', 'b', 'a']"
116,ta9dCTbH2qRqU1Fu,en,vqa,mcq,uae,4,https://s3-eu-north-1-derc-wmi-crowdlabel-production.s3.eu-north-1.amazonaws.com/tii_vqa_fgwnpf38jzgusarn.png,what is the color of the tiny rubber bedouin tent?,"{'a': 'brown', 'b': 'cyan', 'c': 'gray'}",b,"['b', 'a', 'a', 'b', 'b']"
117,qYB5jVaVbJEd9vJb,en,vqa,true-false,underwater,1,https://s3-eu-north-1-derc-wmi-crowdlabel-production.s3.eu-north-1.amazonaws.com/tii_vqa_enxda10ulumtzirv.png,are there fewer large green things than green oxygen tanks?,"{'a': 'False', 'b': 'True'}",a,"['b', 'b', 'a']"
118,2jLx8jc2qhl9JfWi,en,vqa,mcq,construction-site,4,https://s3-eu-north-1-derc-wmi-crowdlabel-production.s3.eu-north-1.amazonaws.com/tii_vqa_eizafl7b8cditrsf.png,what color is the large crane that is made of the same material as the large brown wheelbarrow?,"{'a': 'brown', 'b': 'purple', 'c': 'cyan', 'd': 'yellow', 'e': 'blue'}",c,['c']
119,TQAf2eP0DPB2y339,en,vqa,true-false,underwater,1,https://s3-eu-north-1-derc-wmi-crowdlabel-production.s3.eu-north-1.amazonaws.com/tii_vqa_oprbut4le8o23ypt.png,do the starfish and the coral have the same material?,"{'a': 'True', 'b': 'False'}",a,"['a', 'b', 'a']"
120,PxlsBigtyMSxVZ2v,en,vqa,numeric,music,2,https://s3-eu-north-1-derc-wmi-crowdlabel-production.s3.eu-north-1.amazonaws.com/tii_vqa_601qf58n3jn5qijx.png,how many other things are the same material as the tiny cyan object?,"{'a': '3', 'b': '1'}",b,"['a', 'a', 'a']"
121,zYKWeBs16xP8HwVP,en,vqa,numeric,animals,2,https://s3-eu-north-1-derc-wmi-crowdlabel-production.s3.eu-north-1.amazonaws.com/tii_vqa_85k16q04m04jixsu.png,what number of other small purple metal things are the same shape as the small purple metal thing?,"{'a': '1', 'b': '0'}",a,"['b', 'a', 'a']"
122,IQxKPiPBeu10U36v,en,vqa,true-false,construction-site,1,https://s3-eu-north-1-derc-wmi-crowdlabel-production.s3.eu-north-1.amazonaws.com/tii_vqa_l36dp68q8j2t4x7g.png,are there more big yellow wheelbarrows than rubber things?,"{'a': 'True', 'b': 'False'}",b,"['a', 'a', 'b', 'b']"
123,75GgWWtZzfuiWTg2,en,vqa,numeric,fashion,2,https://s3-eu-north-1-derc-wmi-crowdlabel-production.s3.eu-north-1.amazonaws.com/tii_vqa_vvk5q7ovx258khke.png,what number of other things are made of the same material as the purple pants?,"{'a': '3', 'b': '5'}",a,"['a', 'a', 'b', 'a']"
124,84CBZbty21GtakqR,en,vqa,mcq,garage-workshop,3,https://s3-eu-north-1-derc-wmi-crowdlabel-production.s3.eu-north-1.amazonaws.com/tii_vqa_tzwbnhkl9a44idvf.png,there is a purple thing that is made of the same material as the big tire; what size is it?,"{'a': 'small', 'b': 'large'}",b,"['a', 'b', 'b']"
125,L6OpspQUf1sl2wmT,en,vqa,mcq,kitchen,3,https://s3-eu-north-1-derc-wmi-crowdlabel-production.s3.eu-north-1.amazonaws.com/tii_vqa_eed4s7kufffwfo2f.png,what is the size of the yellow thing that is made of the same material as the big yellow spatula?,"{'a': 'large', 'b': 'small'}",b,"['b', 'a', 'a', 'b', 'b', 'b', 'a', 'b', 'a', 'b']"
126,dEaTuKRKuwZLELWH,en,vqa,numeric,living-room,2,https://s3-eu-north-1-derc-wmi-crowdlabel-production.s3.eu-north-1.amazonaws.com/tii_vqa_zzri3pcbbjkv5fws.png,what number of coffee tables have the same size as the yellow rubber bookshelf?,"{'a': '2', 'b': '3'}",a,"['a', 'a', 'b']"
127,8mGIHN24hU5A6OY1,en,vqa,true-false,medical-field,1,https://s3-eu-north-1-derc-wmi-crowdlabel-production.s3.eu-north-1.amazonaws.com/tii_vqa_cbqqbgnocj0avjyk.png,is there a gray metal iv fluid bag of the same size as the purple stethoscope?,"{'a': 'True', 'b': 'False'}",b,"['a', 'a', 'b', 'a']"
128,jtUd9ODhrshSIdmt,en,vqa,mcq,music,4,https://s3-eu-north-1-derc-wmi-crowdlabel-production.s3.eu-north-1.amazonaws.com/tii_vqa_vueqauc1nbglu2r8.png,what color is the metal mic?,"{'a': 'cyan', 'b': 'yellow', 'c': 'gray'}",b,"['a', 'a', 'a', 'a']"
129,O8TZDOK1pRvblb7U,en,vqa,numeric,office,2,https://s3-eu-north-1-derc-wmi-crowdlabel-production.s3.eu-north-1.amazonaws.com/tii_vqa_qhh6kjeb0uc06itd.png,how many other objects are the same color as the large rubber pen holder?,"{'a': '0', 'b': '1'}",a,['a']
130,hICZO3tIrl4vd3Vl,en,vqa,numeric,school,2,https://s3-eu-north-1-derc-wmi-crowdlabel-production.s3.eu-north-1.amazonaws.com/tii_vqa_8nmbnuhsuoezvq3e.png,what number of large things are made of the same material as the small green notebook?,"{'a': '3', 'b': '5'}",a,"['b', 'b', 'b', 'b', 'a', 'a']"
131,lug1Icaf3fuGG50w,en,vqa,mcq,uae,4,https://s3-eu-north-1-derc-wmi-crowdlabel-production.s3.eu-north-1.amazonaws.com/tii_vqa_lnt3y2dd7oos7e4b.png,there is a tiny metal object that is the same shape as the big object; what color is it?,"{'a': 'gray', 'b': 'yellow', 'c': 'cyan', 'd': 'blue'}",d,"['d', 'd']"
132,JnZKr10dB2tflXnt,en,vqa,mcq,underwater,4,https://s3-eu-north-1-derc-wmi-crowdlabel-production.s3.eu-north-1.amazonaws.com/tii_vqa_ptg7rmzuqi8sunpk.png,what shape is the tiny purple object?,"{'a': 'starfish', 'b': 'coral', 'c': 'snorkel'}",b,"['b', 'a', 'b']"
133,u9DQ3mzBZPLa3fmg,en,vqa,mcq,underwater,3,https://s3-eu-north-1-derc-wmi-crowdlabel-production.s3.eu-north-1.amazonaws.com/tii_vqa_mu0h2qxrtk6j4q44.png,what is the material of the other cyan thing that is the same size as the cyan metal thing?,"{'a': 'rubber', 'b': 'metal'}",a,"['a', 'b', 'a', 'a', 'a']"
134,wHWM2O87mQALPIhL,en,vqa,true-false,living-room,1,https://s3-eu-north-1-derc-wmi-crowdlabel-production.s3.eu-north-1.amazonaws.com/tii_vqa_jrxrgorxb73o1q36.png,is there any other thing that is the same material as the tiny yellow floor lamp?,"{'a': 'False', 'b': 'True'}",a,"['a', 'a', 'b', 'a', 'a']"
135,QTCiYSxHMLqpe6QD,en,vqa,numeric,animals,2,https://s3-eu-north-1-derc-wmi-crowdlabel-production.s3.eu-north-1.amazonaws.com/tii_vqa_a41gahi9lou733bi.png,how many purple things have the same size as the gray rubber thing?,"{'a': '1', 'b': '2'}",b,"['b', 'b', 'a', 'b', 'a', 'a', 'a']"
136,Z8uGf5yNAGL7prtz,en,vqa,numeric,animals,2,https://s3-eu-north-1-derc-wmi-crowdlabel-production.s3.eu-north-1.amazonaws.com/tii_vqa_vb6xbs6rs6tj6ifz.png,how many other things are the same shape as the small red thing?,"{'a': '1', 'b': '0'}",a,"['b', 'b', 'a', 'a', 'b', 'b']"
137,qXDCS9LgMbCxw72M,en,vqa,mcq,construction-site,4,https://s3-eu-north-1-derc-wmi-crowdlabel-production.s3.eu-north-1.amazonaws.com/tii_vqa_f80pbl1im4pptlg1.png,the tiny metal wheelbarrow has what color?,"{'a': 'gray', 'b': 'yellow', 'c': 'blue', 'd': 'purple', 'e': 'cyan'}",b,[]
138,4BM6TAVnkhV7MOn5,en,vqa,true-false,fashion,1,https://s3-eu-north-1-derc-wmi-crowdlabel-production.s3.eu-north-1.amazonaws.com/tii_vqa_bkpcw5y006l622kz.png,is the number of big pants greater than the number of brown metal shoes?,"{'a': 'False', 'b': 'True'}",b,"['a', 'b']"
139,PEgkgCryFLXzzL1G,en,vqa,mcq,garage-workshop,3,https://s3-eu-north-1-derc-wmi-crowdlabel-production.s3.eu-north-1.amazonaws.com/tii_vqa_6qwddbbcwccl942t.png,there is a rubber thing that is the same color as the tiny rubber hammer; what size is it?,"{'a': 'large', 'b': 'small'}",a,"['b', 'b', 'a', 'a']"
140,IjGViYoop60cv0l4,en,vqa,mcq,kitchen,4,https://s3-eu-north-1-derc-wmi-crowdlabel-production.s3.eu-north-1.amazonaws.com/tii_vqa_9xcutoq9zmikl3w8.png,there is another tiny rubber object that is the same shape as the tiny brown rubber object; what is its color?,"{'a': 'yellow', 'b': 'red', 'c': 'gray', 'd': 'cyan'}",a,"['b', 'a', 'b', 'a']"
141,DuyJcCw5ZHbxpcMb,en,vqa,true-false,living-room,1,https://s3-eu-north-1-derc-wmi-crowdlabel-production.s3.eu-north-1.amazonaws.com/tii_vqa_sdwei3izq0pesh8w.png,are there any blue objects that have the same size as the blue metal bookshelf?,"{'a': 'False', 'b': 'True'}",b,"['b', 'a', 'b']"
142,Uc9bgrqN6Dgd0uSD,en,vqa,numeric,medical-field,2,https://s3-eu-north-1-derc-wmi-crowdlabel-production.s3.eu-north-1.amazonaws.com/tii_vqa_igwocpcu3a2xumlk.png,how many small red medicine bottles are the same material as the large yellow stethoscope?,"{'a': '1', 'b': '3'}",a,['a']
143,ReJTMU6n5ucUyS8S,en,vqa,numeric,music,2,https://s3-eu-north-1-derc-wmi-crowdlabel-production.s3.eu-north-1.amazonaws.com/tii_vqa_w0oh1ddvt8kj4s0g.png,how many rubber objects have the same color as the big metal thing?,"{'a': '1', 'b': '3'}",a,"['a', 'b', 'a', 'b', 'a']"
144,2i3Hsiz8FhXJaB6D,en,vqa,mcq,office,4,https://s3-eu-north-1-derc-wmi-crowdlabel-production.s3.eu-north-1.amazonaws.com/tii_vqa_xgmu12pt8ijclxit.png,what is the color of the other small rubber object that is the same shape as the brown thing?,"{'a': 'yellow', 'b': 'green', 'c': 'gray'}",b,"['a', 'a', 'b', 'b']"
145,buAw3bqlTfzBw7Qs,en,vqa,true-false,school,1,https://s3-eu-north-1-derc-wmi-crowdlabel-production.s3.eu-north-1.amazonaws.com/tii_vqa_uo3qqn29s1rakr05.png,are there any tiny rubber things that have the same color as the rubber notebook?,"{'a': 'False', 'b': 'True'}",b,"['b', 'a']"
146,ygBnDEYBpRhsujNx,en,vqa,numeric,uae,2,https://s3-eu-north-1-derc-wmi-crowdlabel-production.s3.eu-north-1.amazonaws.com/tii_vqa_dk2d79lw9vu6kzhe.png,how many other things are the same shape as the blue object?,"{'a': '1', 'b': '0'}",a,"['b', 'a', 'a', 'a']"
147,5uFnwrvEnYcjtPv4,en,vqa,true-false,underwater,1,https://s3-eu-north-1-derc-wmi-crowdlabel-production.s3.eu-north-1.amazonaws.com/tii_vqa_7n3nmr85k132rzpm.png,are there any other things of the same color as the rubber fish?,"{'a': 'True', 'b': 'False'}",b,['b']
148,8lH3r1JK7cZB5hJy,en,vqa,mcq,medical-field,4,https://s3-eu-north-1-derc-wmi-crowdlabel-production.s3.eu-north-1.amazonaws.com/tii_vqa_ba6c0wzm34kahpuy.png,the purple thing that is made of the same material as the big cyan medicine bottle is what shape?,"{'a': 'medicine bottle', 'b': 'injection', 'c': 'stethoscope', 'd': 'hospital bed', 'e': 'iv fluid bag'}",b,"['a', 'a', 'a', 'b']"
149,cpPx8JthcLURI6Je,en,vqa,true-false,fashion,1,https://s3-eu-north-1-derc-wmi-crowdlabel-production.s3.eu-north-1.amazonaws.com/tii_vqa_nudeu9p78apcp90g.png,are the yellow shoe and the yellow pants made of the same material?,"{'a': 'True', 'b': 'False'}",b,"['a', 'b', 'b', 'a']"
150,xKMLznjXHryYLexI,en,vqa,numeric,medical-field,2,https://s3-eu-north-1-derc-wmi-crowdlabel-production.s3.eu-north-1.amazonaws.com/tii_vqa_52oerf05ffrno55l.png,how many other objects are there of the same shape as the tiny metal thing?,"{'a': '0', 'b': '1'}",b,"['a', 'b']"
151,ZUxmUM2jJYx0QFUt,en,vqa,numeric,animals,2,https://s3-eu-north-1-derc-wmi-crowdlabel-production.s3.eu-north-1.amazonaws.com/tii_vqa_jc6240z3gr9mhiki.png,how many other objects are there of the same shape as the large metal object?,"{'a': '2', 'b': '3'}",b,"['b', 'a', 'b']"
152,snVPF2GdUkydGpCg,en,vqa,true-false,construction-site,1,https://s3-eu-north-1-derc-wmi-crowdlabel-production.s3.eu-north-1.amazonaws.com/tii_vqa_9nc0gpcsv4yo4ydp.png,are there any blue traffic cones of the same size as the yellow thing?,"{'a': 'True', 'b': 'False'}",a,"['b', 'b', 'b', 'a']"
153,btYKowXz6BRjEZLa,en,vqa,mcq,fashion,4,https://s3-eu-north-1-derc-wmi-crowdlabel-production.s3.eu-north-1.amazonaws.com/tii_vqa_zz7f4maov0xq27y4.png,what shape is the large yellow thing?,"{'a': 'hat', 'b': 'pants', 'c': 'bag', 'd': 'shirt', 'e': 'shoe'}",b,['b']
154,89VqdaqTOCW1ENc4,en,vqa,mcq,garage-workshop,4,https://s3-eu-north-1-derc-wmi-crowdlabel-production.s3.eu-north-1.amazonaws.com/tii_vqa_l91lurykprthujhe.png,what color is the metal tire that is the same size as the blue metal thing?,"{'a': 'red', 'b': 'cyan', 'c': 'gray', 'd': 'blue'}",a,"['b', 'a', 'b']"
155,tbH3Ek7XoK71xNIK,en,vqa,mcq,kitchen,4,https://s3-eu-north-1-derc-wmi-crowdlabel-production.s3.eu-north-1.amazonaws.com/tii_vqa_b33dns4o00qnz4cm.png,what is the shape of the yellow metal thing?,"{'a': 'spatula', 'b': 'plate', 'c': 'fork'}",c,"['a', 'c', 'c']"
156,Kcf7YvhMCDZPGVM5,en,vqa,numeric,living-room,2,https://s3-eu-north-1-derc-wmi-crowdlabel-production.s3.eu-north-1.amazonaws.com/tii_vqa_40g9zymncs812b8z.png,how many small things are either metal coffee tables or green televisions?,"{'a': '1', 'b': '0'}",a,"['a', 'a', 'b', 'a', 'a']"
157,pGgCAhbjeZ2aYBCq,en,vqa,numeric,medical-field,2,https://s3-eu-north-1-derc-wmi-crowdlabel-production.s3.eu-north-1.amazonaws.com/tii_vqa_7sswaocyuoj921bb.png,what number of other objects are the same shape as the big yellow thing?,"{'a': '4', 'b': '3'}",b,"['b', 'a', 'b', 'a', 'a']"
158,YZCysFUroZfHaIJE,en,vqa,numeric,music,2,https://s3-eu-north-1-derc-wmi-crowdlabel-production.s3.eu-north-1.amazonaws.com/tii_vqa_psz45kdura0wrt58.png,what number of other things are the same color as the large metal object?,"{'a': '0', 'b': '1'}",a,"['b', 'b', 'a']"
159,jtCg8E9k7oMeFCYt,en,vqa,mcq,office,4,https://s3-eu-north-1-derc-wmi-crowdlabel-production.s3.eu-north-1.amazonaws.com/tii_vqa_8ey58c7dmvua4m34.png,what shape is the tiny rubber thing that is the same color as the large rubber object?,"{'a': 'chair', 'b': 'pen holder', 'c': 'calculator', 'd': 'laptop'}",a,"['a', 'b', 'a', 'b']"
160,PZpJPthClLZ6vJP6,en,vqa,mcq,school,4,https://s3-eu-north-1-derc-wmi-crowdlabel-production.s3.eu-north-1.amazonaws.com/tii_vqa_exvfvh3otyh41dd7.png,what shape is the big yellow thing?,"{'a': 'backpack', 'b': 'notebook', 'c': 'ruler', 'd': 'lunch box'}",b,[]
161,iubojbVIi1WjJRvW,en,vqa,numeric,uae,2,https://s3-eu-north-1-derc-wmi-crowdlabel-production.s3.eu-north-1.amazonaws.com/tii_vqa_7dj451kedcxffbg5.png,what number of objects are large dallahs or metal bedouin tents?,"{'a': '4', 'b': '6'}",a,"['a', 'b', 'a', 'a', 'b']"
162,V2ZKpkwLBMJlbGcg,en,vqa,mcq,underwater,4,https://s3-eu-north-1-derc-wmi-crowdlabel-production.s3.eu-north-1.amazonaws.com/tii_vqa_eykx589y8cptnu6u.png,what shape is the large thing that is the same color as the big rubber coral?,"{'a': 'starfish', 'b': 'snorkel', 'c': 'oxygen tank', 'd': 'fish', 'e': 'turtle'}",a,['a']
163,PqvTrJOFxJNBJ6q4,en,vqa,mcq,uae,3,https://s3-eu-north-1-derc-wmi-crowdlabel-production.s3.eu-north-1.amazonaws.com/tii_vqa_9armq3r2dz1kqex2.png,there is a yellow bedouin tent that is the same size as the yellow metal falcon stand; what is it made of?,"{'a': 'rubber', 'b': 'metal'}",a,"['a', 'b', 'a', 'b', 'a']"
164,J5AuJJNQTCAGzGMh,en,vqa,true-false,living-room,1,https://s3-eu-north-1-derc-wmi-crowdlabel-production.s3.eu-north-1.amazonaws.com/tii_vqa_22dny8i1j1qpxm3u.png,is there any other thing that has the same material as the large sofa?,"{'a': 'True', 'b': 'False'}",a,"['b', 'a', 'b']"
165,9gzjU84UVXhS3uW1,en,vqa,numeric,music,2,https://s3-eu-north-1-derc-wmi-crowdlabel-production.s3.eu-north-1.amazonaws.com/tii_vqa_dmr8igitof17t8dg.png,what number of things are either large green objects or rubber drums?,"{'a': '4', 'b': '2'}",b,"['a', 'a', 'b']"
166,eW2JB7KP0KLuI3Li,en,vqa,mcq,animals,3,https://s3-eu-north-1-derc-wmi-crowdlabel-production.s3.eu-north-1.amazonaws.com/tii_vqa_gro5qucokewucmau.png,there is a red thing that is the same material as the large green cat; what is its size?,"{'a': 'small', 'b': 'large'}",a,"['a', 'a', 'b', 'b', 'b', 'a']"
167,l7nd6GSijHGCFnr8,en,vqa,numeric,construction-site,2,https://s3-eu-north-1-derc-wmi-crowdlabel-production.s3.eu-north-1.amazonaws.com/tii_vqa_9no5jm6wje424don.png,how many rubber objects are either large cranes or tiny blue wheelbarrows?,"{'a': '1', 'b': '0'}",b,"['a', 'a', 'a', 'b', 'a', 'b']"
168,0jPeW7ABopuGeOqV,en,vqa,mcq,fashion,4,https://s3-eu-north-1-derc-wmi-crowdlabel-production.s3.eu-north-1.amazonaws.com/tii_vqa_doq5p3sic6nwk3sa.png,there is a red thing that is the same size as the red pants; what is its shape?,"{'a': 'shoe', 'b': 'bag', 'c': 'hat', 'd': 'shirt', 'e': 'pants'}",b,[]
169,bZPuBHIW88QMFvgz,en,vqa,numeric,garage-workshop,2,https://s3-eu-north-1-derc-wmi-crowdlabel-production.s3.eu-north-1.amazonaws.com/tii_vqa_2zbokliuwfs5ac6o.png,how many big rubber tires have the same color as the wrench?,"{'a': '1', 'b': '2'}",a,"['b', 'a', 'a', 'a', 'a', 'a', 'a']"
170,KjvQ1D1iwo6PziSl,en,vqa,true-false,kitchen,1,https://s3-eu-north-1-derc-wmi-crowdlabel-production.s3.eu-north-1.amazonaws.com/tii_vqa_d8te2nd9864bcb0b.png,is there any other thing that has the same shape as the blue object?,"{'a': 'True', 'b': 'False'}",a,"['a', 'a', 'a']"
171,WPJo7ZeYNytEKDBU,en,vqa,mcq,living-room,3,https://s3-eu-north-1-derc-wmi-crowdlabel-production.s3.eu-north-1.amazonaws.com/tii_vqa_5jdynwge6scm2v4u.png,there is a thing that is the same color as the large sofa; what is it made of?,"{'a': 'rubber', 'b': 'metal'}",a,"['a', 'a']"
172,S7xIdbpUVHNpKt7T,en,vqa,mcq,medical-field,3,https://s3-eu-north-1-derc-wmi-crowdlabel-production.s3.eu-north-1.amazonaws.com/tii_vqa_ej9cbf37n9nxasns.png,what is the tiny gray iv fluid bag made of?,"{'a': 'rubber', 'b': 'metal'}",a,"['a', 'a', 'b', 'a']"
173,wCSXLwbzi7h12TPm,en,vqa,true-false,music,1,https://s3-eu-north-1-derc-wmi-crowdlabel-production.s3.eu-north-1.amazonaws.com/tii_vqa_knkiunzhghobu6nr.png,are there any other things of the same color as the rubber flute?,"{'a': 'True', 'b': 'False'}",a,"['a', 'a', 'b']"
174,SgN6xc40syt8i6zF,en,vqa,mcq,office,4,https://s3-eu-north-1-derc-wmi-crowdlabel-production.s3.eu-north-1.amazonaws.com/tii_vqa_sn8tx0n2alorfzzw.png,what is the shape of the gray object that is made of the same material as the yellow coffee mug?,"{'a': 'coffee mug', 'b': 'pen holder', 'c': 'laptop', 'd': 'calculator', 'e': 'chair'}",d,"['d', 'd', 'a', 'd', 'a', 'd', 'a']"
175,KK8xKxh1Bb2JiuwU,en,vqa,mcq,school,3,https://s3-eu-north-1-derc-wmi-crowdlabel-production.s3.eu-north-1.amazonaws.com/tii_vqa_fk2dobpqg6vjh67f.png,what size is the blue notebook?,"{'a': 'large', 'b': 'small'}",a,['a']
176,xdvzPe42Q9tVYEr1,en,vqa,mcq,uae,3,https://s3-eu-north-1-derc-wmi-crowdlabel-production.s3.eu-north-1.amazonaws.com/tii_vqa_eg274mdpmmy8qa78.png,there is a red falcon stand that is the same size as the rubber bedouin tent; what is its material?,"{'a': 'rubber', 'b': 'metal'}",a,['a']
177,E2T951d2rNksgMyo,en,vqa,mcq,underwater,3,https://s3-eu-north-1-derc-wmi-crowdlabel-production.s3.eu-north-1.amazonaws.com/tii_vqa_oy68s3jpejwd0mog.png,there is a yellow oxygen tank that is the same size as the green metal object; what material is it?,"{'a': 'rubber', 'b': 'metal'}",a,"['a', 'b', 'a', 'a']"
178,vueYdu2WKQQ5McIE,en,vqa,mcq,garage-workshop,3,https://s3-eu-north-1-derc-wmi-crowdlabel-production.s3.eu-north-1.amazonaws.com/tii_vqa_8831hr6d10pv8to2.png,there is another cyan thing that is the same shape as the big cyan rubber object; what is its material?,"{'a': 'metal', 'b': 'rubber'}",a,"['b', 'b', 'a', 'a', 'a']"
179,6OfJ2NqaBMJmAwxK,en,vqa,true-false,construction-site,1,https://s3-eu-north-1-derc-wmi-crowdlabel-production.s3.eu-north-1.amazonaws.com/tii_vqa_15vffxah2zbnlum1.png,is the rubber hard hat the same color as the small rubber crane?,"{'a': 'True', 'b': 'False'}",b,"['a', 'b']"
